{
  "authority": "applied",
  "contentVersion": "v1",
  "levelRange": null,
  "stages": [
    {
      "stageId": "stage.01-01",
      "normalExperience": 3,
      "bossExperience": 15,
      "normalRice": 1,
      "bossRice": 10,
      "firstClear": null
    },
    {
      "stageId": "stage.01-02",
      "normalExperience": 8,
      "bossExperience": 40,
      "normalRice": 2,
      "bossRice": 20,
      "firstClear": null
    },
    {
      "stageId": "stage.01-03",
      "normalExperience": 11,
      "bossExperience": 55,
      "normalRice": 3,
      "bossRice": 30,
      "firstClear": null
    },
    {
      "stageId": "stage.01-04",
      "normalExperience": 13,
      "bossExperience": 65,
      "normalRice": 4,
      "bossRice": 40,
      "firstClear": null
    },
    {
      "stageId": "stage.01-05",
      "normalExperience": 15,
      "bossExperience": 75,
      "normalRice": 5,
      "bossRice": 50,
      "firstClear": null
    },
    {
      "stageId": "stage.01-06",
      "normalExperience": 16,
      "bossExperience": 80,
      "normalRice": 6,
      "bossRice": 60,
      "firstClear": null
    },
    {
      "stageId": "stage.01-07",
      "normalExperience": 17,
      "bossExperience": 85,
      "normalRice": 7,
      "bossRice": 70,
      "firstClear": null
    },
    {
      "stageId": "stage.01-08",
      "normalExperience": 18,
      "bossExperience": 90,
      "normalRice": 8,
      "bossRice": 80,
      "firstClear": null
    },
    {
      "stageId": "stage.01-09",
      "normalExperience": 19,
      "bossExperience": 95,
      "normalRice": 9,
      "bossRice": 90,
      "firstClear": null
    },
    {
      "stageId": "stage.01-10",
      "normalExperience": 19,
      "bossExperience": 95,
      "normalRice": 10,
      "bossRice": 100,
      "firstClear": null
    },
    {
      "stageId": "stage.02-01",
      "normalExperience": 20,
      "bossExperience": 100,
      "normalRice": 11,
      "bossRice": 110,
      "firstClear": null
    },
    {
      "stageId": "stage.02-02",
      "normalExperience": 20,
      "bossExperience": 100,
      "normalRice": 12,
      "bossRice": 120,
      "firstClear": null
    },
    {
      "stageId": "stage.02-03",
      "normalExperience": 21,
      "bossExperience": 105,
      "normalRice": 13,
      "bossRice": 130,
      "firstClear": null
    },
    {
      "stageId": "stage.02-04",
      "normalExperience": 21,
      "bossExperience": 105,
      "normalRice": 14,
      "bossRice": 140,
      "firstClear": null
    },
    {
      "stageId": "stage.02-05",
      "normalExperience": 22,
      "bossExperience": 110,
      "normalRice": 15,
      "bossRice": 150,
      "firstClear": null
    },
    {
      "stageId": "stage.02-06",
      "normalExperience": 22,
      "bossExperience": 110,
      "normalRice": 16,
      "bossRice": 160,
      "firstClear": null
    },
    {
      "stageId": "stage.02-07",
      "normalExperience": 22,
      "bossExperience": 110,
      "normalRice": 17,
      "bossRice": 170,
      "firstClear": null
    },
    {
      "stageId": "stage.02-08",
      "normalExperience": 22,
      "bossExperience": 110,
      "normalRice": 18,
      "bossRice": 180,
      "firstClear": null
    },
    {
      "stageId": "stage.02-09",
      "normalExperience": 23,
      "bossExperience": 115,
      "normalRice": 19,
      "bossRice": 190,
      "firstClear": null
    },
    {
      "stageId": "stage.02-10",
      "normalExperience": 23,
      "bossExperience": 115,
      "normalRice": 20,
      "bossRice": 200,
      "firstClear": null
    },
    {
      "stageId": "stage.03-01",
      "normalExperience": 23,
      "bossExperience": 115,
      "normalRice": 21,
      "bossRice": 210,
      "firstClear": null
    },
    {
      "stageId": "stage.03-02",
      "normalExperience": 23,
      "bossExperience": 115,
      "normalRice": 22,
      "bossRice": 220,
      "firstClear": null
    },
    {
      "stageId": "stage.03-03",
      "normalExperience": 23,
      "bossExperience": 115,
      "normalRice": 23,
      "bossRice": 230,
      "firstClear": null
    },
    {
      "stageId": "stage.03-04",
      "normalExperience": 23,
      "bossExperience": 115,
      "normalRice": 24,
      "bossRice": 240,
      "firstClear": null
    },
    {
      "stageId": "stage.03-05",
      "normalExperience": 24,
      "bossExperience": 120,
      "normalRice": 25,
      "bossRice": 250,
      "firstClear": null
    },
    {
      "stageId": "stage.03-06",
      "normalExperience": 24,
      "bossExperience": 120,
      "normalRice": 26,
      "bossRice": 260,
      "firstClear": null
    },
    {
      "stageId": "stage.03-07",
      "normalExperience": 24,
      "bossExperience": 120,
      "normalRice": 27,
      "bossRice": 270,
      "firstClear": null
    },
    {
      "stageId": "stage.03-08",
      "normalExperience": 24,
      "bossExperience": 120,
      "normalRice": 28,
      "bossRice": 280,
      "firstClear": null
    },
    {
      "stageId": "stage.03-09",
      "normalExperience": 24,
      "bossExperience": 120,
      "normalRice": 29,
      "bossRice": 290,
      "firstClear": null
    },
    {
      "stageId": "stage.03-10",
      "normalExperience": 24,
      "bossExperience": 120,
      "normalRice": 30,
      "bossRice": 300,
      "firstClear": null
    },
    {
      "stageId": "stage.04-01",
      "normalExperience": 24,
      "bossExperience": 120,
      "normalRice": 31,
      "bossRice": 310,
      "firstClear": null
    },
    {
      "stageId": "stage.04-02",
      "normalExperience": 24,
      "bossExperience": 120,
      "normalRice": 32,
      "bossRice": 320,
      "firstClear": null
    },
    {
      "stageId": "stage.04-03",
      "normalExperience": 24,
      "bossExperience": 120,
      "normalRice": 33,
      "bossRice": 330,
      "firstClear": null
    },
    {
      "stageId": "stage.04-04",
      "normalExperience": 24,
      "bossExperience": 120,
      "normalRice": 34,
      "bossRice": 340,
      "firstClear": null
    },
    {
      "stageId": "stage.04-05",
      "normalExperience": 25,
      "bossExperience": 125,
      "normalRice": 35,
      "bossRice": 350,
      "firstClear": null
    },
    {
      "stageId": "stage.04-06",
      "normalExperience": 25,
      "bossExperience": 125,
      "normalRice": 36,
      "bossRice": 360,
      "firstClear": null
    },
    {
      "stageId": "stage.04-07",
      "normalExperience": 25,
      "bossExperience": 125,
      "normalRice": 37,
      "bossRice": 370,
      "firstClear": null
    },
    {
      "stageId": "stage.04-08",
      "normalExperience": 25,
      "bossExperience": 125,
      "normalRice": 38,
      "bossRice": 380,
      "firstClear": null
    },
    {
      "stageId": "stage.04-09",
      "normalExperience": 25,
      "bossExperience": 125,
      "normalRice": 39,
      "bossRice": 390,
      "firstClear": null
    },
    {
      "stageId": "stage.04-10",
      "normalExperience": 25,
      "bossExperience": 125,
      "normalRice": 40,
      "bossRice": 400,
      "firstClear": null
    }
  ]
}
